{
    "$schema": "http://json-schema.org/draft-07/schema#",
    "title": "创建任务",
    "description": "post /api/automation/v1/dag/{dagId}",
    "type": "object",
    "properties": {
        "title": {
            "oneOf": [
                {
                    "description": "任务名称,名称不能包含 /:*?\"<>| 特殊字符，长度不能超过128个字符",
                    "type": "string",
                    "pattern": "^[^/:\\*?\"<>\\|]+$",
                    "maxLength": 128
                },
                {
                    "type": "null"
                }
            ]
        },
        "description": {
            "description": "详情描述,不允许换行输入,不允许超过300个字符",
            "oneOf": [
                {
                    "type": "string",
                    "maxLength": 300
                },
                {
                    "type": "null"
                }
            ]
        },
        "status": {
            "description": "任务状态，默认启用",
            "enum": [
                null,
                "normal",
                "stopped"
            ]
        },
        "steps": {
            "oneOf": [
                {
                    "description": "自动化流程定义",
                    "type": "array",
                    "items": {
                        "type": "object"
                    },
                    "minItems": 2,
                    "uniqueItems": true
                },
                {
                    "type": "null"
                }
            ]
        },
        "shortcuts": {
            "description": "入口类型",
            "type": "array",
            "items": {
                "type": "string",
                "enum": [
                    "workcenter"
                ]
            }
        },
        "accessors": {
            "description": "显示入口的用户/部门/用户组",
            "type": "array",
            "items": {
                "type": "object",
                "properties": {
                    "id": {
                        "type": "string",
                        "description": "访问者id",
                        "maxLength": 36
                    },
                    "name": {
                        "type": "string",
                        "description": "访问者name",
                        "maxLength": 200
                    },
                    "type": {
                        "type": "string",
                        "enum": [
                            "user",
                            "department",
                            "contactor",
                            "group"
                        ]
                    }
                }
            }
        },
        "emails": {
            "description": "任务执行失败时告警邮件发送列表",
            "type": "array",
            "items": {
                "type": "string",
                "pattern": "^[a-zA-Z0-9_.+-]+@[a-zA-Z0-9-]+\\.[a-zA-Z0-9-.]+$"
            }
        },
        "published": {
            "description": "Whether the DAG is published",
            "type": "boolean",
            "default": false
        }
    },
    "additionalProperties": false
}
